"Var1","Relation","Var2","Cor","Topic","Stage","Type","Confirmed","Notes","bibref"
"small-scale multilingualism","~","linguistic diversity","pos","bilingualism","language change","review","none","by definition, contexts of small-scale multilingualism are highly linguistically diverse","vaughan2018indigenous"
"small-scale multilingualism","~","linguistic accommodation","neg","bilingualism","language change","review","none","contexts of small-scale multilingualism feature a lack of accommodation - people shifting to the language another person is using in order to create a monolingual interaction (see receptive multilingualism)","vaughan2018indigenous"
"small-scale multilingualism","~","population size","pos","bilingualism","language change","review","none","small-scale multilingual contexts tend to support many small languages","vaughan2018indigenous"
"hierarchical structure","~","small-scale multilingualims","pos","bilingualism","language change","review","none","contexts of small-scale multilingualism tend not to have highly hierarchical social structure","vaughan2018indigenous"
"small-scale multilingulaism","~","polyglossia","neg","bilingualism","language change","review","none","small-scale multilingual contexts do not have polyglossia - hierarchical status differences between Indigenous languages (but colonisation may create polyglossia between national languages and Indigenous languages)","vaughan2018indigenous"
