"Var1","Relation","Var2","Cor","Topic","Stage","Type","Confirmed","Notes","bibref"
"population size",">","cultural selection: stability","pos","","language change","model","none","""By allowing for stochasticity in the learning process of linguistic constituents, it is shown that a constituent's stability and fitness increases with population size, but that high variability in the learning environment may cause constituent loss, also in large populations.""","baumann2018linguistic"
"variation in learning sets",">","cultural selection: stability","neg","","language change","model","none","""By allowing for stochasticity in the learning process of linguistic constituents, it is shown that a constituent's stability and fitness increases with population size, but that high variability in the learning environment may cause constituent loss, also in large populations.""","baumann2018linguistic"
"word learnability","~=","cultural selection: stability","none","","language change","model","none","""Thus, the basic reproductive ratio [= the expected number of learners that learn an item which has been innovatively introduced into the population by a single user] functions as a measure of the stability of a linguistic item""","baumann2018linguistic"
"cultural selection: learnability","~=","cultural selection: stability","none","","language change","model","none","""Thus, the basic reproductive ratio [= the expected number of learners that learn an item which has been innovatively introduced into the population by a single user] functions as a measure of the stability of a linguistic item""","baumann2018linguistic"
"learning exposures","~=","cultural selection: stability","none","","language change","model","none","""Thus, the basic reproductive ratio [= the expected number of learners that learn an item which has been innovatively introduced into the population by a single user] functions as a measure of the stability of a linguistic item""","baumann2018linguistic"
"population size",">","learning exposures","pos","","language change","model","none","""Note, crucially, that since the amount of individuals which can acquire an item from a user depends on the number of learners available in the population [then the basic reproductive ratio] depends on population size.""","baumann2018linguistic"
"learning exposures",">","language acquisition","pos","","language change","model","none","""Thus, items with high learning rates and high usability should be selected for. That is, items are expected to evolve in such a way that they maximize ease of acquisition, production and use (probably governed by some trade-off among these factors).""","baumann2018linguistic"
"population size",">","word learnability","pos","","language change","model","none","""Moreover, the effect of optimizing ð [learnability and usability] ð gets stronger the larger the population size, so that items are expected to be less optimized in small populations.""","baumann2018linguistic"
"population size",">","fixation of non-optimal solutions","neg","","language change","model","none","""Moreover, the effect of optimizing ð [learnability and usability] ð gets stronger the larger the population size, so that items are expected to be less optimized in small populations.""","baumann2018linguistic"
"learning fidelity",">","cultural selection: stability","pos","","language change","model","none","""Improving factors that determine learning does always contribute to an item's success""","baumann2018linguistic"
"migration",">","phoneme inventory size","neg","","language change","review","none","""For instance, it can be argued that the small phoneme inventories found in a number of remote Polynesian languages (Trudgill, 2004) might be a reflex of migration and concomitant variability in network density.""","baumann2018linguistic"
"learning fidelity",">","phoneme inventory size","none","","language change","model","none","""we can conclude that the establishment of an inventory of constituents (e.g. lexicon of words or phoneme inventory) requires a relatively stable learning environment""","baumann2018linguistic"
"variation in learning sets",">","phoneme inventory size","neg","","language change","model","none","""we can conclude that the establishment of an inventory of constituents (e.g. lexicon of words or phoneme inventory) requires a relatively stable learning environment""","baumann2018linguistic"
"population size",">","lexicon:rate of change","pos","","language change","model","none","""...evolution proceeds faster in large populations. At first sight, this may seem paradox: population size is predicted to increase the stability of an item, but at the same time population size drives linguistic optimization, where an item is effectively replaced by a more successful version of itself. Note, crucially, that the more optimized variant is less likely to get lost.""","baumann2018linguistic"
"spatial heterogeneity",">","variation in learning sets","pos","","language change","model","none","""The model builds on the assumption that the learning process depends on a mass-action law (i.e., interactions are proportional with the product of the number of learners and users). It has been pointed out (de Jong, Diekmann, & Heesterbeek, 1996), that this assumption does not hold in large populations in realistic ecological scenarios. Consequently, the effect of population size on the basic reproductive ratio is probably overestimated as populations become larger.""","baumann2018linguistic"
"heterogeneity of speech community",">","variation in learning sets","pos","","language change","model","none","""The model builds on the assumption that the learning process depends on a mass-action law (i.e., interactions are proportional with the product of the number of learners and users). It has been pointed out (de Jong, Diekmann, & Heesterbeek, 1996), that this assumption does not hold in large populations in realistic ecological scenarios. Consequently, the effect of population size on the basic reproductive ratio is probably overestimated as populations become larger.""","baumann2018linguistic"
